ID_num,job_title,Short_description,Skills_required,Industry,Pay_grade
427,Sustainable Building Inspector,Evaluate construction projects for environmental compliance,Building Codes Environmental Standards Attention to Detail Communication Problem Solving,Construction,Average paying
428,Digital Wellness Researcher,Study the effects of technology on human health and behavior,Research Methods Psychology Data Analysis Communication Critical Thinking,Science & Research,High paying
430,Online Community Moderator,Maintain safe and productive digital discussion spaces,Communication Problem Solving Critical Thinking Conflict Resolution Attention to Detail,Technology,Low paying
432,Digital Asset Appraiser,Evaluate the value of cryptocurrency and digital collectibles,Financial Analysis Technology Knowledge Research Skills Communication Problem Solving,Finance,High paying
434,Virtual Reality Training Developer,Create immersive educational and skills training programs,Instructional Design Programming 3D Modeling Communication Innovation,Education,High paying
435,Carbon Credit Analyst,Evaluate and trade environmental impact offsets,Environmental Science Financial Analysis Research Skills Communication Problem Solving,Environmental Services,High paying
436,Digital Nomad Visa Consultant,Advise on immigration requirements for remote workers,Immigration Law Research Skills Communication Problem Solving Cultural Awareness,Legal Services,Average paying
440,Digital Estate Executor,Manage digital assets and accounts after someone passes away,Legal Knowledge Technology Skills Communication Problem Solving Organization,Legal Services,Average paying
442,Virtual Reality Social Worker,Provide counseling and support through immersive technology,Social Work Technology Skills Empathy Communication Innovation,Social Services,High paying
444,Digital Literacy Instructor,Teach technology skills to underserved populations,Teaching Skills Technology Knowledge Communication Patience Cultural Sensitivity,Education,Low paying
445,Sustainable Fashion Designer,Create clothing with minimal environmental impact,Fashion Design Environmental Awareness Creativity Innovation Problem Solving,Fashion,Average paying
447,Rainforest Conservation Guide,Lead educational tours while protecting tropical ecosystems,Environmental Science Teaching Skills Communication Physical Fitness Conservation Biology,Environmental Services,Average paying
448,Digital Payment Security Analyst,Protect online financial transactions from fraud,Cybersecurity Financial Systems Problem Solving Attention to Detail Communication,Finance,High paying
452,Digital Privacy Educator,Teach individuals and organizations about online security,Cybersecurity Teaching Skills Communication Technology Knowledge Problem Solving,Education,Average paying
453,Heritage Fruit Tree Cultivator,Grow and preserve rare and antique fruit varieties,Horticulture Conservation Biology Agriculture Research Skills Problem Solving,Agriculture,Average paying
454,Virtual Reality Meditation Guide,Lead mindfulness sessions in immersive digital environments,Meditation Teaching Technology Skills Communication Mindfulness Training,Wellness,Average paying
456,Digital Content Creator,Produce engaging multimedia content for online audiences,Creativity Communication Technology Skills Marketing Problem Solving,Media & Publishing,Average paying
460,Digital Marketing Strategist,Develop comprehensive online marketing campaigns,Marketing Strategy Communication Analytical Thinking Creativity Problem Solving,Marketing,High paying
461,Traditional Craft Instructor,Teach historical handicraft techniques and skills,Craftsmanship Teaching Skills Communication Cultural Knowledge Patience,Arts & Culture,Low paying
463,Pollinator Habitat Restorer,Create and maintain spaces for bees butterflies and beneficial insects,Ecology Conservation Biology Environmental Science Problem Solving Research Skills,Environmental Services,Average paying
464,Digital Transformation Consultant,Help organizations adapt to new technologies and processes,Business Consulting Technology Strategy Communication Problem Solving Change Management,Consulting,High paying
466,Online Community Builder,Create and grow digital spaces for shared interests and goals,Community Management Communication Social Media Problem Solving Relationship Building,Technology,Average paying
468,Digital Product Manager,Oversee development and launch of software products and applications,Product Management Technology Strategy Communication Problem Solving Leadership,Technology,High paying
469,Sustainable Tourism Guide,Lead eco friendly travel experiences while preserving destinations,Tourism Environmental Awareness Communication Cultural Knowledge Problem Solving,Tourism,Average paying
470,Virtual Reality Healthcare Developer,Create medical training and patient treatment applications,Healthcare Technology Programming Innovation Problem Solving,Healthcare,High paying
472,Digital Analytics Consultant,Help organizations understand and optimize their online performance,Data Analysis Marketing Technology Communication Problem Solving,Consulting,High paying
474,Online Education Quality Assurance Specialist,Ensure digital learning programs meet educational standards,Education Quality Control Communication Problem Solving Attention to Detail,Education,Average paying
476,Digital Accessibility Developer,Create inclusive technology solutions for people with disabilities,Web Development Accessibility Standards Problem Solving Communication Innovation,Technology,High paying
477,Heritage Livestock Guardian,Protect and preserve rare farm animal breeds,Animal Husbandry Conservation Biology Genetics Problem Solving Research Skills,Agriculture,Average paying
478,Virtual Reality Architecture Visualizer,Create immersive previews of building designs,Architecture 3D Modeling Technology Skills Creativity Communication,Architecture,Average paying
480,Digital Brand Strategist,Develop online identity and positioning for organizations,Branding Marketing Strategy Communication Creativity Problem Solving,Marketing,High paying
481,Traditional Building Craft Specialist,Preserve historical construction techniques and skills,Construction Cultural Heritage Manual Dexterity Problem Solving Teaching Skills,Construction,Average paying
482,Online Learning Community Manager,Foster engagement and connection in educational platforms,Community Management Education Communication Problem Solving Technology Skills,Education,Average paying
483,Renewable Energy Project Developer,Plan and implement clean energy installations,Project Management Renewable Energy Finance Communication Problem Solving,Renewable Energy,High paying
484,Digital Employee Experience Designer,Optimize remote work environments and company culture,Human Resources Technology Skills Communication Problem Solving Psychology,Human Resources,High paying
486,Virtual Reality Sports Trainer,Use immersive technology to improve athletic performance,Sports Training Technology Skills Communication Motivation Innovation,Sports,Average paying
487,Biodiversity Conservation Coordinator,Protect and restore species and habitat diversity,Conservation Biology Environmental Science Research Skills Problem Solving Communication,Environmental Services,High paying
488,Digital Marketing Automation Developer,Create systems that automate online marketing processes,Marketing Technology Programming Problem Solving Innovation,Marketing,High paying
489,Traditional Medicine Plant Cultivator,Grow herbs and plants used in historical healing practices,Botany Traditional Medicine Agriculture Research Skills Problem Solving,Agriculture,Average paying
490,Online Workshop Facilitator,Lead interactive learning sessions through digital platforms,Teaching Skills Communication Technology Skills Problem Solving Group Dynamics,Education,Average paying
491,Sustainable Water Systems Designer,Create eco friendly water treatment and distribution systems,Environmental Engineering Water Management Problem Solving Innovation Sustainability,Environmental Services,High paying
492,Digital Customer Experience Analyst,Study and improve online user interactions and satisfaction,User Experience Research Data Analysis Communication Problem Solving,Technology,High paying
493,Heritage Grain Grower and Miller,Cultivate and process ancient wheat and grain varieties,Agriculture Food Processing Traditional Skills Quality Control Problem Solving,Agriculture,Average paying
494,Virtual Reality Museum Curator,Create immersive cultural and educational experiences,Museum Studies Technology Skills Communication Creativity Research Skills,Cultural Heritage,Average paying
496,Digital Wellness Program Coordinator,Develop and manage technology balance initiatives for organizations,Wellness Coaching Program Management Communication Problem Solving Psychology,Wellness,Average paying
500,Digital Innovation Consultant,Help organizations adopt emerging technologies and future focused strategies,Technology Strategy Innovation Management Communication Problem Solving,Consulting,High paying
501,Machine Learning Engineer,Design and implement ML algorithms for production systems,Python; TensorFlow; Statistics; Cloud Platforms; Data Engineering,Technology,High paying
502,Cybersecurity Architect,Design comprehensive security frameworks for enterprise systems,Security Protocols; Risk Assessment; Network Security; Compliance; Leadership,Technology,High paying
504,Cloud Solutions Architect,Design scalable cloud infrastructure and migration strategies,AWS/Azure; Microservices; DevOps; System Design; Cost Optimization,Technology,High paying
505,AI Research Scientist,Conduct advanced research in artificial intelligence and machine learning,Deep Learning; Research Methodology; Statistical Analysis; Python; Publications,Science & Research,High paying
506,Blockchain Developer,Develop decentralized applications and smart contracts,Solidity; Web3; Cryptography; Distributed Systems; JavaScript,Technology,High paying
508,Petroleum Engineer,Design extraction methods for oil and gas resources,Reservoir Engineering; Drilling Technology; Geology; Safety Protocols; CAD,Oil & Gas,High paying
510,Aerospace Engineer,Design aircraft and spacecraft systems,Aerodynamics; CAD; Materials Science; Systems Engineering; Testing,Aerospace,High paying
511,Clinical Research Scientist,Lead clinical trials for new medical treatments,Clinical Trial Design; Statistical Analysis; Regulatory Knowledge; Medical Writing; Ethics,Healthcare,High paying
512,Quantitative Analyst,Develop mathematical models for financial trading,Mathematics; Python/R; Statistics; Risk Management; Financial Markets,Finance,High paying
513,Senior Software Architect,Design large-scale software systems and technical strategy,System Design; Architecture Patterns; Leadership; Multiple Programming Languages; Scalability,Technology,High paying
514,Data Engineering Manager,Lead teams building data infrastructure and pipelines,Data Architecture; Team Leadership; Big Data Tools; Cloud Platforms; Strategy,Technology,High paying
515,Pharmaceutical Scientist,Research and develop new drugs and medical treatments,Chemistry; Pharmacology; Clinical Research; Regulatory Affairs; Laboratory Skills,Healthcare,High paying
518,Biomedical Engineer,Design medical devices and equipment,Engineering Design; Biology; Medical Device Regulations; CAD; Testing,Healthcare,High paying
521,Solutions Engineer,Provide technical expertise to support sales and implementations,Technical Sales; Problem Solving; Communication; Software Architecture; Customer Success,Technology,Average paying
522,Digital Marketing Specialist,Develop and execute digital marketing campaigns,SEO/SEM; Social Media; Analytics; Content Marketing; A/B Testing,Marketing,Average paying
523,Technical Writer,Create documentation for software and technical products,Technical Writing; Documentation Tools; Software Understanding; Communication; Research,Technology,Average paying
526,Quality Assurance Engineer,Ensure software quality through testing and validation,Test Automation; Bug Tracking; Testing Methodologies; Scripting; Attention to Detail,Technology,Average paying
527,Recruitment Specialist,Source and recruit talent for various organizational roles,Talent Acquisition; Interviewing; Networking; Communication; ATS Systems,Human Resources,Average paying
532,Supply Chain Analyst,Optimize supply chain operations and logistics,Supply Chain Management; Data Analysis; Forecasting; Process Improvement; ERP Systems,Logistics,Average paying
534,Systems Administrator,Maintain and troubleshoot IT infrastructure and systems,System Administration; Networking; Troubleshooting; Scripting; Security,Technology,Average paying
535,Credit Analyst,Evaluate creditworthiness of individuals and organizations,Credit Analysis; Financial Statement Analysis; Risk Assessment; Regulatory Knowledge; Attention to Detail,Finance,Average paying
536,Training Coordinator,Organize and deliver training programs for employees,Training Development; Presentation Skills; Learning Management Systems; Communication; Organization,Human Resources,Average paying
537,Database Administrator,Manage and maintain database systems and data integrity,Database Management; SQL; Backup and Recovery; Performance Tuning; Security,Technology,Average paying
541,Laboratory Technician,Conduct scientific tests and experiments in laboratory settings,Laboratory Techniques; Data Collection; Scientific Equipment; Safety Protocols; Attention to Detail,Science & Research,Average paying
543,Health Information Technician,Manage and organize healthcare data and records,Medical Coding; Health Information Systems; Data Management; Privacy Regulations; Attention to Detail,Healthcare,Average paying
548,Manufacturing Engineer,Optimize manufacturing processes and production efficiency,Manufacturing Processes; Lean Manufacturing; CAD; Process Improvement; Quality Control,Manufacturing,Average paying
551,Help Desk Technician,Provide first-level technical support to end users,Technical Support; Troubleshooting; Customer Service; IT Systems; Communication,Technology,Low paying
554,Data Entry Clerk,Input and maintain accurate data in computer systems,Data Entry; Attention to Detail; Typing Speed; Database Software; Accuracy,Business Services,Low paying
557,Retail Sales Associate,Assist customers with purchases and product information,Customer Service; Sales Skills; Product Knowledge; Cash Handling; Communication,Retail,Low paying
559,Security Guard,Monitor premises and ensure safety and security,Security Procedures; Observation Skills; Communication; Physical Fitness; Emergency Response,Security,Low paying
560,Janitor,Maintain cleanliness and sanitation of facilities,Cleaning Techniques; Equipment Operation; Attention to Detail; Physical Stamina; Time Management,Cleaning Services,Low paying
563,Maintenance Worker,Perform routine maintenance and repairs on facilities,Maintenance Skills; Tool Usage; Problem Solving; Safety Protocols; Physical Skills,Maintenance Services,Low paying
565,Kitchen Assistant,Support kitchen operations in food service establishments,Food Preparation; Sanitation; Teamwork; Physical Stamina; Following Instructions,Food Service,Low paying
568,Housekeeping Aide,Clean and maintain residential or commercial properties,Cleaning Skills; Attention to Detail; Time Management; Physical Stamina; Reliability,Cleaning Services,Low paying
577,Principal Data Scientist,Lead data science initiatives and advanced analytics projects,Advanced Statistics; Machine Learning; Team Leadership; Business Strategy; Python/R,Technology,High paying
578,Senior DevOps Engineer,Design and implement CI/CD pipelines and infrastructure automation,DevOps; Kubernetes; Cloud Platforms; Infrastructure as Code; Automation,Technology,High paying
579,Enterprise Architect,Design enterprise-wide technology architecture and standards,Enterprise Architecture; System Integration; Technology Strategy; Leadership; Communication,Technology,High paying
584,Principal Software Engineer,Lead complex software development projects and technical decisions,Advanced Programming; System Design; Technical Leadership; Code Review; Mentoring,Technology,High paying
587,Chief Data Officer,Lead enterprise data strategy and governance initiatives,Data Strategy; Data Governance; Analytics; Leadership; Digital Transformation,Executive Leadership,High paying
590,VP of Engineering,Lead engineering organizations and technical strategy,Engineering Leadership; Technical Strategy; Team Building; Product Development; Innovation,Technology,High paying
593,Technical Support Engineer,Provide advanced technical support for software products,Technical Troubleshooting; Customer Service; Software Knowledge; Communication; Problem Solving,Technology,Average paying
598,Site Reliability Engineer,Ensure reliability and performance of production systems,System Reliability; Monitoring; Automation; Incident Response; Performance Optimization,Technology,Average paying
601,Junior Software Developer,Develop software applications under senior guidance,Programming; Debugging; Version Control; Testing; Learning Agility,Technology,Average paying
604,IT Support Specialist,Provide technical support for hardware and software issues,IT Support; Hardware Troubleshooting; Software Installation; Customer Service; Documentation,Technology,Average paying
620,Veterinary Technician,Assist veterinarians with animal care and medical procedures,Veterinary Medicine; Animal Handling; Medical Equipment; Patient Care; Attention to Detail,Animal Services,Average paying
633,Furniture Mover,Transport furniture and household items,Physical Strength; Lifting Techniques; Customer Service; Teamwork; Problem Solving,Moving Services,Low paying
637,Golf Course Maintenance,Maintain golf course grounds and facilities,Landscaping; Equipment Operation; Physical Labor; Attention to Detail; Early Hours,Recreation,Low paying
641,Senior Quality Engineer,Lead quality assurance programs and process improvements,Quality Management; Statistical Analysis; Process Improvement; Leadership; Compliance,Manufacturing,High paying
644,Senior Research Scientist,Conduct advanced research and lead scientific projects,Research Methodology; Scientific Analysis; Grant Writing; Team Leadership; Publication,Science & Research,High paying
649,Principal Solutions Architect,Design enterprise-level technical solutions,Solution Architecture; Technical Leadership; Client Consulting; System Integration; Innovation,Technology,High paying
651,Digital Product Manager,Manage digital product development and user experience,Product Management; Digital Strategy; User Experience; Agile Development; Analytics,Technology,Average paying
654,Network Engineer,Design and maintain network infrastructure,Network Engineering; Cisco Technologies; Troubleshooting; Security; Documentation,Technology,Average paying
655,Training Manager,Develop and oversee organizational training programs,Training Management; Curriculum Development; Adult Learning; Team Leadership; Assessment,Human Resources,Average paying
657,Email Marketing Specialist,Develop and execute email marketing campaigns,Email Marketing; Marketing Automation; A/B Testing; Analytics; Creative Writing,Marketing,Average paying
658,Application Support Analyst,Provide support for business applications and systems,Application Support; Troubleshooting; SQL; Business Analysis; Customer Service,Technology,Average paying
660,Facilities Manager,Manage building operations and maintenance,Facilities Management; Vendor Management; Maintenance Planning; Budgeting; Safety Compliance,Facilities Management,Average paying
664,Mail Clerk,Sort and distribute mail within organization,Mail Sorting; Organization; Attention to Detail; Physical Activity; Time Management,Postal Services,Low paying
672,Kitchen Prep Cook,Prepare ingredients and assist with food preparation,Food Preparation; Kitchen Safety; Sanitation; Teamwork; Time Management,Food Service,Low paying
674,Retail Stock Clerk,Receive and stock merchandise in retail stores,Inventory Management; Physical Labor; Attention to Detail; Organization; Teamwork,Retail,Low paying
683,Principal Engineer,Lead engineering excellence and technical innovation,Technical Leadership; Engineering Excellence; System Architecture; Mentoring; Innovation,Technology,High paying
685,Head of Data Science,Lead data science organization and AI initiatives,Data Science Leadership; Machine Learning; AI Strategy; Team Building; Advanced Analytics,Technology,High paying
690,Director of Engineering,Lead engineering teams and technical delivery,Engineering Management; Technical Strategy; Team Building; Product Development; Innovation,Technology,High paying
696,AI Prompt Engineer,Design and optimize prompts for AI language models,Prompt Engineering; NLP; Data Analysis; Creativity; Experimentation,Technology,High paying
698,Electric Vehicle Technician,Maintain and repair electric vehicles and charging stations,EV Systems; Diagnostics; Electrical Engineering; Safety Protocols; Problem Solving,Automotive,Average paying
702,Digital Health Coach,Guide clients in using technology for health and wellness,Health Coaching; Digital Tools; Communication; Motivation; Data Tracking,Healthcare,Average paying
703,3D Printing Technician,Operate and maintain 3D printers for various applications,3D Printing; CAD; Troubleshooting; Material Science; Attention to Detail,Manufacturing,Average paying
704,Online Fundraising Specialist,Plan and execute digital fundraising campaigns for nonprofits,Fundraising; Digital Marketing; Communication; Analytics; Campaign Management,Nonprofit,Average paying
706,Urban Mobility Planner,Design transportation solutions for growing cities,Urban Planning; Transportation Systems; Data Analysis; Communication; Innovation,Urban Development,Average paying
707,AI Ethics Consultant,Advise organizations on responsible AI use,Ethics; AI Policy; Communication; Risk Assessment; Research,Technology,High paying
708,Hydrogen Fuel Cell Technician,Maintain and repair hydrogen energy systems,Hydrogen Systems; Diagnostics; Electrical Engineering; Safety Protocols; Troubleshooting,Energy,Average paying
709,Digital Currency Compliance Officer,Ensure cryptocurrency operations meet legal standards,Compliance; Cryptocurrency; Regulatory Knowledge; Risk Management; Communication,Finance,High paying
710,Remote Learning Facilitator,Support students and teachers in virtual classrooms,Education Technology; Communication; Organization; Troubleshooting; Empathy,Education,Average paying
712,Plant-Based Food Developer,Create new vegan and vegetarian food products,Food Science; Nutrition; Product Development; Innovation; Quality Control,Food Production,Average paying
713,Digital Twin Analyst,Monitor and optimize virtual models of real-world systems,Data Analysis; Simulation; IoT; Problem Solving; Reporting,Technology,Average paying
714,Personal Cybersecurity Coach,Help individuals protect their digital lives,Cybersecurity; Communication; Training; Risk Assessment; Technology Awareness,Technology,Average paying
716,AI Model Validator,Test and verify machine learning models for accuracy,Machine Learning; Testing; Data Analysis; Documentation; Python,Technology,High paying
717,Digital Art Curator,Select and manage digital art collections,Art History; Digital Media; Curation; Communication; Research,Arts & Culture,Average paying
720,Remote Customer Success Trainer,Teach best practices for virtual client support,Training; Customer Success; Communication; Technology Skills; Coaching,Business Services,Average paying
721,AI Data Labeling Supervisor,Oversee teams tagging data for machine learning,Team Management; Data Annotation; Quality Control; Communication; Organization,Technology,Average paying
722,Digital Agriculture Consultant,Advise farms on technology adoption,Agriculture; Technology; Data Analysis; Communication; Project Management,Agriculture,High paying
724,Virtual Reality Safety Trainer,Develop VR-based safety training programs,VR Development; Safety Protocols; Instructional Design; Communication; Innovation,Technology,High paying
726,Digital Supply Chain Analyst,Monitor and optimize online supply networks,Supply Chain; Data Analysis; Technology; Problem Solving; Reporting,Logistics,Average paying
728,AI-Driven Content Strategist,Plan content using artificial intelligence tools,Content Strategy; AI Tools; Analytics; Communication; Creativity,Media & Publishing,High paying
730,Digital Accessibility Tester,Test websites and apps for accessibility compliance,Accessibility Standards; Testing; Reporting; Communication; Empathy,Technology,Average paying
731,Online Fitness Program Designer,Create digital exercise and wellness plans,Fitness; Program Design; Technology; Communication; Motivation,Fitness & Recreation,Average paying
733,AI-Powered Marketing Analyst,Leverage AI to optimize marketing campaigns,Marketing Analytics; AI Tools; Data Interpretation; Reporting; Communication,Marketing,High paying
734,Digital Fundraising Campaign Manager,Lead online donation drives for nonprofits,Fundraising; Digital Marketing; Campaign Management; Analytics; Communication,Nonprofit,Average paying
736,Remote IT Asset Manager,Track and manage distributed technology resources,IT Asset Management; Organization; Technology; Reporting; Communication,Technology,Average paying
737,Digital Health Data Analyst,Analyze patient data from digital health tools,Data Analysis; Healthcare; Reporting; Privacy; Technology,Healthcare,High paying
739,Remote HR Compliance Auditor,Ensure virtual teams follow employment laws,HR Compliance; Auditing; Communication; Documentation; Organization,Human Resources,High paying
740,AI Chatbot Designer,Create conversational flows for automated assistants,Conversation Design; AI Tools; UX; Scripting; Creativity,Technology,High paying
