ID_num,job_title,Short_description,Skills_required,Industry,Pay_grade
1,Software Engineer,Develop and maintain web applications using modern frameworks,Problem Solving Logical Reasoning Attention to Detail Team Collaboration Critical Thinking,Technology,High paying
2,Data Scientist,Analyze large datasets to extract business insights and build predictive models,Analytical Thinking Pattern Recognition Mathematical Reasoning Problem Solving Research Skills,Technology,High paying
11,Content Writer,Create engaging content for websites blogs and marketing materials,Creative Writing Research Skills Communication Adaptability Time Management,Media & Publishing,Average paying
12,Network Administrator,Maintain and troubleshoot computer networks and systems,Problem Solving Technical Troubleshooting Logical Reasoning Attention to Detail Patience,Technology,Average paying
16,DevOps Engineer,Implement CI/CD pipelines and manage cloud infrastructure,Problem Solving Systems Thinking Automation Mindset Continuous Learning Technical Troubleshooting,Technology,High paying
17,Quality Assurance Tester,Test software applications to identify bugs and ensure quality,Attention to Detail Critical Thinking Problem Solving Patience Systematic Thinking,Technology,Average paying
19,Research Scientist,Conduct scientific research and publish findings,Critical Thinking Research Skills Analytical Reasoning Persistence Scientific Writing,Research & Development,High paying
21,Web Developer,Build and maintain websites using various programming languages,Problem Solving Creative Thinking Attention to Detail Continuous Learning Adaptability,Technology,Average paying
24,Mechanical Engineer,Design and develop mechanical systems and products,Problem Solving Mathematical Reasoning Spatial Reasoning Critical Thinking Project Management,Engineering,High paying
25,Digital Marketing Specialist,Execute digital marketing campaigns across multiple channels,Analytical Thinking Creative Problem Solving Data Interpretation Communication Trend Awareness,Marketing,Average paying
26,Database Administrator,Manage and maintain database systems and ensure data integrity,Logical Reasoning Problem Solving Attention to Detail Systems Thinking Security Awareness,Technology,Average paying
28,Video Editor,Edit and produce video content for various media platforms,Creativity Attention to Detail Time Management Visual Storytelling Technical Aptitude,Media & Publishing,Average paying
29,Cybersecurity Analyst,Monitor and protect computer systems from security threats,Critical Thinking Problem Solving Attention to Detail Ethical Reasoning Continuous Learning,Technology,High paying
30,Supply Chain Coordinator,Manage inventory and coordinate logistics operations,Organization Analytical Thinking Communication Problem Solving Time Management,Logistics,Average paying
31,Mobile App Developer,Develop mobile applications for iOS and Android platforms,Problem Solving Logical Reasoning User Experience Design Attention to Detail Innovation,Technology,High paying
33,Electrical Engineer,Design electrical systems and troubleshoot electrical problems,Problem Solving Mathematical Reasoning Safety Awareness Attention to Detail Critical Thinking,Engineering,High paying
35,Technical Writer,Create technical documentation and user manuals,Communication Clarity Logical Organization Research Skills Attention to Detail,Media & Publishing,Average paying
40,Civil Engineer,Design and supervise construction of infrastructure projects,Problem Solving Mathematical Reasoning Safety Awareness Project Management Critical Thinking,Engineering,High paying
48,Architect,Design buildings and oversee construction projects,Creativity Problem Solving Spatial Reasoning Communication Project Management,Architecture,High paying
55,Personal Trainer,Provide fitness training and exercise guidance to clients,Motivation Communication Goal Setting Safety Awareness Adaptability,Fitness & Recreation,Low paying
62,Hair Stylist,Provide hair cutting styling and coloring services,Creativity Communication Client Relations Manual Dexterity Trend Awareness,Personal Care,Low paying
65,Security Guard,Monitor and protect property and people,Vigilance Communication Problem Solving Stress Management Physical Fitness,Security,Low paying
69,Janitor,Maintain cleanliness and sanitation of buildings,Attention to Detail Time Management Physical Stamina Safety Awareness Work Ethic,Facilities Management,Low paying
71,Waiter,Serve food and beverages to restaurant customers,Communication Customer Service Multitasking Memory Physical Stamina,Food Service,Low paying
72,Retail Sales Associate,Assist customers and process sales transactions,Communication Customer Service Persuasion Product Knowledge Patience,Retail,Low paying
83,Laboratory Technician,Perform laboratory tests and analyze samples,Attention to Detail Safety Awareness Analytical Thinking Organization Technical Aptitude,Healthcare,Average paying
84,Pharmacist Technician,Assist pharmacists with medication preparation and inventory,Attention to Detail Organization Communication Customer Service Mathematical Accuracy,Healthcare,Low paying
87,Dietitian,Provide nutrition counseling and meal planning services,Communication Analytical Thinking Empathy Research Skills Health Awareness,Healthcare,Average paying
88,Environmental Scientist,Study environmental problems and develop solutions,Research Skills Analytical Thinking Problem Solving Communication Environmental Awareness,Environmental Services,High paying
98,Political Scientist,Study political systems and analyze political behavior,Research Skills Analytical Thinking Critical Thinking Communication Writing Skills,Social Sciences,High paying
103,Editor,Review and edit written content for publication,Attention to Detail Communication Writing Skills Critical Thinking Organization,Media & Publishing,Average paying
107,Copywriter,Write persuasive content for advertising and marketing,Creative Writing Communication Persuasion Brand Awareness Research Skills,Advertising,Average paying
109,Screenwriter,Write scripts for films television and other media,Creative Writing Storytelling Research Skills Character Development Communication,Entertainment,Average paying
112,Sound Engineer,Operate audio equipment for recordings and live events,Technical Aptitude Attention to Detail Problem Solving Communication Creativity,Entertainment,Average paying
120,Athletic Trainer,Provide injury prevention and treatment for athletes,Physical Assessment Communication Problem Solving Safety Awareness Empathy,Sports,Average paying
138,Wind Turbine Technician,Maintain and repair wind energy equipment,Safety Awareness Physical Fitness Problem Solving Manual Dexterity Environmental Awareness,Renewable Energy,Average paying
139,HVAC Technician,Install and repair heating ventilation and air conditioning systems,Problem Solving Manual Dexterity Safety Awareness Attention to Detail Customer Service,Construction,Average paying
140,Locksmith,Install and repair locks and security systems,Problem Solving Manual Dexterity Attention to Detail Customer Service Security Awareness,Security,Average paying
143,Tailor,Alter and create custom clothing and garments,Manual Dexterity Attention to Detail Customer Service Problem Solving Creativity,Personal Services,Low paying
148,Blacksmith,Shape and forge metal objects using traditional techniques,Physical Stamina Manual Dexterity Safety Awareness Problem Solving Craftsmanship,Arts & Crafts,Average paying
152,Quality Control Inspector,Inspect products to ensure they meet quality standards,Attention to Detail Analytical Thinking Problem Solving Communication Organization,Manufacturing,Average paying
163,Air Traffic Controller,Direct aircraft movement and ensure flight safety,Attention to Detail Multitasking Communication Stress Management Decision Making,Aviation,High paying
164,Ship Captain,Navigate and command ships and vessels,Leadership Navigation Skills Decision Making Safety Awareness Communication,Maritime,High paying
165,Train Conductor,Operate trains and ensure passenger safety,Safety Awareness Communication Attention to Detail Responsibility Problem Solving,Transportation,Average paying
169,Mail Carrier,Deliver mail and packages to residential and business addresses,Physical Stamina Attention to Detail Customer Service Navigation Time Management,Postal Services,Average paying
174,Golf Course Maintenance,Maintain golf courses and playing surfaces,Attention to Detail Physical Stamina Environmental Awareness Equipment Operation Problem Solving,Recreation,Low paying
175,Pool Maintenance Technician,Clean and maintain swimming pools and spas,Safety Awareness Attention to Detail Customer Service Problem Solving Chemical Knowledge,Maintenance Services,Low paying
176,Pest Control Technician,Identify and eliminate pest infestations,Problem Solving Safety Awareness Customer Service Attention to Detail Environmental Awareness,Pest Control,Average paying
183,Bailiff,Maintain order in courtrooms and provide security,Communication Physical Fitness Authority Safety Awareness Conflict Resolution,Legal Services,Average paying
189,Benefits Administrator,Manage employee benefits programs and enrollment,Communication Organization Attention to Detail Customer Service Problem Solving,Human Resources,Average paying
190,Training Coordinator,Develop and coordinate employee training programs,Communication Organization Presentation Skills Problem Solving Leadership,Human Resources,Average paying
191,Talent Acquisition Specialist,Recruit and hire qualified candidates for positions,Communication Relationship Building Assessment Skills Persuasion Organization,Human Resources,Average paying
196,Regulatory Affairs Specialist,Ensure compliance with industry regulations,Attention to Detail Communication Analytical Thinking Problem Solving Organization,Regulatory Affairs,Average paying
198,Internal Auditor,Examine financial records and internal controls,Analytical Thinking Attention to Detail Problem Solving Communication Ethical Reasoning,Finance,High paying
199,External Auditor,Conduct independent audits of organizations,Analytical Thinking Attention to Detail Communication Ethical Reasoning Critical Thinking,Finance,High paying
209,Vice President of Engineering,Lead engineering teams and technical strategy,Technical Leadership Strategic Thinking Team Management Innovation Problem Solving,Executive Leadership,High paying
215,Auction House Appraiser,Evaluate and authenticate valuable items for auction,Art History Valuation Skills Authentication Research Attention to Detail,Art & Antiques,Average paying
227,Robotics Engineer,Design and program automated systems and robots,Programming Mechanical Design Systems Integration Problem Solving Innovation,Robotics,High paying
228,Blockchain Developer,Create decentralized applications and cryptocurrency systems,Programming Cryptography Distributed Systems Security Protocols Innovation,Technology,High paying
229,Sustainability Consultant,Advise organizations on environmental and social responsibility,Environmental Science Strategic Planning Data Analysis Communication Stakeholder Management,Environmental Services,High paying
236,Quantum Computing Researcher,Develop quantum algorithms and computing systems,Quantum Physics Programming Mathematical Modeling Research Skills Innovation,Science & Research,High paying
239,Viticulturist,Grow and harvest grapes for wine production,Agricultural Science Soil Management Weather Analysis Quality Control Seasonal Planning,Agriculture,Average paying
242,Biomechanical Engineer,Design medical devices and prosthetics,Engineering Principles Medical Knowledge CAD Design Problem Solving Innovation,Engineering,High paying
243,Food Scientist,Research food safety nutrition and product development,Chemistry Biology Food Safety Regulations Research Skills Innovation,Food Science,High paying
253,Atmospheric Scientist,Study weather patterns and climate change,Meteorology Data Analysis Research Skills Environmental Science Mathematical Modeling,Environmental Sciences,High paying
254,Biomedical Engineer,Design medical equipment and biological systems,Engineering Biology Medical Devices Problem Solving Innovation,Engineering,High paying
256,Virtual Reality Developer,Create immersive digital experiences and applications,3D Programming User Experience Design Spatial Design Innovation Technical Skills,Technology,High paying
258,Artificial Intelligence Trainer,Develop and train machine learning models,Machine Learning Programming Data Science Algorithm Development Problem Solving,Technology,High paying
260,Nanotechnology Engineer,Design and create materials at the molecular level,Materials Science Physics Chemistry Innovation Problem Solving,Engineering,High paying
270,Renewable Energy Technician,Install and maintain solar wind and other clean energy systems,Electrical Skills Safety Protocols Problem Solving Environmental Awareness Equipment Maintenance,Renewable Energy,Average paying
271,Cybersecurity Consultant,Advise organizations on digital security strategies,Cybersecurity Risk Assessment Communication Strategic Planning Problem Solving,Technology,High paying
274,Cognitive Behavioral Therapist,Provide specialized mental health treatment,Psychology Therapeutic Techniques Active Listening Empathy Problem Solving,Healthcare,High paying
275,Synthetic Biology Engineer,Design and create artificial biological systems,Biology Engineering Programming Innovation Problem Solving,Biotechnology,High paying
276,Digital Forensics Investigator,Recover and analyze digital evidence for legal cases,Computer Forensics Legal Procedures Attention to Detail Problem Solving Technical Analysis,Law Enforcement,High paying
283,Augmented Reality Developer,Create applications that blend digital and physical worlds,Programming 3D Modeling User Experience Innovation Problem Solving,Technology,High paying
285,Bioinformatics Specialist,Analyze biological data using computational methods,Biology Programming Data Analysis Mathematical Modeling Research Skills,Science & Research,High paying
286,Sustainable Architecture Designer,Design environmentally friendly buildings and structures,Architecture Environmental Science Energy Systems Creative Design Project Management,Architecture,High paying
290,Bioprinting Technician,Operate 3D printers that create biological tissues,Biology 3D Printing Technology Medical Knowledge Attention to Detail Innovation,Biotechnology,High paying
291,Smart City Planner,Design technology integrated urban environments,Urban Planning Technology Systems Analysis Innovation Strategic Thinking,Urban Development,High paying
292,Neuroengineering Researcher,Develop brain computer interfaces and neural devices,Neuroscience Engineering Programming Innovation Problem Solving,Science & Research,High paying
297,Cellular Agriculture Scientist,Develop lab grown meat and dairy products,Biology Food Science Innovation Problem Solving Research Skills,Food Science,High paying
298,Digital Twin Engineer,Create virtual replicas of physical systems,Engineering Programming Data Analysis Systems Modeling Innovation,Technology,High paying
299,Space Elevator Engineer,Design transportation systems between Earth and space,Aerospace Engineering Materials Science Physics Innovation Problem Solving,Aerospace,High paying
300,Quantum Cryptography Specialist,Develop ultra secure communication systems using quantum mechanics,Quantum Physics Cryptography Programming Security Protocols Innovation,Technology,High paying
302,Biocement Engineer,Develop self healing concrete and construction materials,Materials Science Biology Engineering Innovation Problem Solving,Construction,High paying
304,Swarm Robotics Coordinator,Manage groups of autonomous robots working together,Robotics Programming Systems Coordination Problem Solving Innovation,Technology,High paying
306,Quantum Sensor Developer,Create ultra precise measurement instruments,Quantum Physics Engineering Innovation Problem Solving Technical Skills,Technology,High paying
309,Metamaterial Engineer,Design materials with properties not found in nature,Materials Science Physics Engineering Innovation Problem Solving,Engineering,High paying
310,Biocomputer Programmer,Develop computing systems using biological components,Biology Programming Innovation Problem Solving Technical Skills,Biotechnology,High paying
311,Magnetic Levitation Engineer,Design transportation systems using magnetic forces,Electrical Engineering Physics Transportation Innovation Problem Solving,Transportation,High paying
315,Hypersonic Flight Engineer,Design aircraft capable of extreme speeds,Aerospace Engineering Aerodynamics Innovation Problem Solving Technical Skills,Aerospace,High paying
317,Gravity Wave Detector Operator,Monitor cosmic gravitational disturbances,Physics Data Analysis Technical Skills Attention to Detail Research Skills,Science & Research,High paying
318,Programmable Matter Engineer,Design materials that can change shape and properties,Materials Science Programming Physics Innovation Problem Solving,Engineering,High paying
320,Biorefinery Process Engineer,Convert biological waste into useful products,Chemical Engineering Biology Environmental Science Innovation Problem Solving,Biotechnology,High paying
321,Telepathic Interface Developer,Create brain to brain communication systems,Neuroscience Programming Innovation Problem Solving Technical Skills,Science & Research,High paying
322,Molecular Assembler Technician,Build products atom by atom using nanotechnology,Nanotechnology Precision Manufacturing Technical Skills Innovation Problem Solving,Manufacturing,High paying
327,Digital Archivist,Preserve and organize digital cultural heritage materials,Information Science Digital Preservation Metadata Standards Organization Technical Skills,Cultural Heritage,Average paying
328,Ethical AI Auditor,Evaluate artificial intelligence systems for bias and fairness,Machine Learning Ethics Critical Thinking Problem Solving Communication,Technology,High paying
338,Digital Detox Coach,Help individuals reduce technology dependency and digital overwhelm,Counseling Skills Psychology Technology Awareness Communication Goal Setting,Wellness,Average paying
340,Rope Access Technician,Perform maintenance on tall structures using climbing techniques,Physical Fitness Safety Protocols Problem Solving Manual Dexterity Risk Assessment,Maintenance Services,Average paying
347,Digital Rights Advocate,Protect online privacy and digital freedoms,Legal Knowledge Technology Understanding Advocacy Skills Communication Research Skills,Legal Services,Average paying
351,Cave Rescue Technician,Perform emergency rescues in underground environments,Technical Rescue Skills Physical Fitness Problem Solving Safety Protocols Risk Assessment,Emergency Services,Average paying
352,Digital Accessibility Consultant,Ensure websites and apps are usable by people with disabilities,Web Development Accessibility Standards Problem Solving Communication Technical Skills,Technology,Average paying
354,Voice Recognition Trainer,Improve speech recognition software accuracy,Linguistics Computer Science Audio Processing Communication Technical Skills,Technology,Average paying
355,Competitive Eating Coach,Train professional competitive eaters,Nutrition Knowledge Coaching Skills Psychology Performance Analysis Safety Awareness,Sports,Low paying
356,Digital Nomad Consultant,Help remote workers optimize location independent careers,Business Consulting Technology Skills Communication Cultural Awareness Travel Planning,Consulting,Average paying
360,Meditation Teacher,Instruct individuals and groups in mindfulness practices,Mindfulness Training Communication Empathy Teaching Skills Stress Management,Wellness,Low paying
361,Digital Nomad Tax Advisor,Provide tax services for location independent workers,Tax Law International Regulations Communication Problem Solving Attention to Detail,Financial Services,Average paying
363,Sleep Study Technician,Monitor patients during overnight sleep assessments,Medical Technology Patient Care Attention to Detail Technical Equipment Problem Solving,Healthcare,Average paying
367,Digital Estate Planner,Help families manage digital assets after death,Estate Planning Technology Skills Communication Problem Solving Legal Knowledge,Legal Services,Average paying
371,Digital Minimalism Coach,Help people simplify their digital lives and reduce screen time,Psychology Communication Goal Setting Technology Awareness Lifestyle Coaching,Wellness,Average paying
373,Aquarium Maintenance Specialist,Care for fish tanks and aquatic ecosystems,Aquatic Biology Water Chemistry Equipment Maintenance Customer Service Problem Solving,Pet Services,Low paying
375,Digital Marketing Automation Specialist,Create automated marketing campaigns and workflows,Marketing Technology Programming Analytics Creative Thinking,Marketing,High paying
377,Home Energy Auditor,Assess residential energy efficiency and recommend improvements,Energy Systems Knowledge Problem Solving Communication Attention to Detail Technical Skills,Energy Services,Average paying
378,Pet Portrait Artist,Create artistic representations of companion animals,Artistic Skills Animal Behavior Customer Service Creativity Communication,Arts & Crafts,Low paying
379,Digital Privacy Consultant,Advise individuals and organizations on online privacy protection,Cybersecurity Legal Knowledge Communication Problem Solving Technology Skills,Technology,Average paying
382,Digital Asset Recovery Specialist,Help retrieve lost cryptocurrency and digital files,Cybersecurity Problem Solving Attention to Detail Communication Technical Skills,Technology,High paying
384,Virtual Reality Therapist,Use VR technology to treat phobias and mental health conditions,Psychology Technology Skills Therapeutic Techniques Empathy Innovation,Healthcare,High paying
386,Digital Content Moderator,Review and filter online content for appropriateness,Attention to Detail Critical Thinking Communication Problem Solving Cultural Awareness,Technology,Low paying
389,Digital Wellness Coach,Help individuals develop healthy relationships with technology,Psychology Communication Goal Setting Technology Awareness Lifestyle Coaching,Wellness,Average paying
391,Sound Bath Practitioner,Provide therapeutic sound healing sessions,Musical Skills Healing Techniques Communication Empathy Mindfulness,Wellness,Low paying
393,Digital Sabbath Consultant,Help individuals and organizations implement technology breaks,Psychology Communication Time Management Wellness Coaching Technology Awareness,Wellness,Average paying
397,Digital Legacy Planner,Help people prepare their online presence for after death,Technology Planning Communication Legal Knowledge Problem Solving,Professional Services,Average paying
398,Rain Water Harvesting Specialist,Design systems to collect and utilize rainwater,Environmental Engineering Water Management Problem Solving Sustainability Planning,Environmental Services,Average paying
400,Digital Detox Retreat Leader,Organize and lead technology free wellness experiences,Event Planning Communication Leadership Wellness Coaching Outdoor Skills,Wellness,Average paying
401,Heritage Breed Livestock Conservationist,Preserve rare and endangered farm animal breeds,Animal Husbandry Conservation Biology Genetics Agriculture Problem Solving,Agriculture,Average paying
402,Online Community Manager,Build and moderate digital communities for brands and organizations,Communication Social Media Marketing Community Building Problem Solving,Marketing,Average paying
404,Digital Nomad Insurance Advisor,Provide coverage solutions for location independent workers,Insurance Knowledge Travel Regulations Communication Problem Solving Risk Assessment,Insurance,Average paying
406,Virtual Assistant Trainer,Teach skills for remote administrative support work,Business Skills Communication Teaching Technology Skills Organization,Professional Services,Average paying
407,Sustainable Fashion Consultant,Advise on environmentally conscious clothing choices,Fashion Knowledge Environmental Awareness Communication Sustainability Problem Solving,Fashion,Average paying
408,Digital Archaeology Researcher,Use technology to study ancient civilizations and artifacts,Archaeology Technology Skills Research Methods Data Analysis Problem Solving,Cultural Heritage,High paying
412,Digital Product Designer,Create user centered digital products and applications,User Experience Design Problem Solving Creativity Technology Skills Communication,Technology,High paying
414,Remote Team Building Facilitator,Organize activities to strengthen distributed teams,Communication Leadership Psychology Team Dynamics Problem Solving,Human Resources,Average paying
416,Digital Anthropologist,Study how technology affects human behavior and culture,Anthropology Research Skills Data Analysis Communication Critical Thinking,Social Sciences,High paying
418,Virtual Reality Fitness Instructor,Lead exercise classes in immersive digital environments,Fitness Training Technology Skills Communication Motivation Innovation,Fitness & Recreation,Average paying
420,Digital Rights Lawyer,Practice law focused on technology and online issues,Legal Knowledge Technology Understanding Communication Problem Solving Research Skills,Legal Services,High paying
424,Digital Marketing Analytics Specialist,Analyze online marketing data to optimize campaigns,Data Analysis Marketing Knowledge Problem Solving Communication Technical Skills,Marketing,High paying
425,Heritage Seed Keeper,Preserve heirloom plant varieties for future generations,Botany Conservation Genetics Agriculture Research Skills,Environmental Services,Average paying
426,Virtual Reality Game Designer,Create immersive gaming experiences and worlds,Game Design Programming Creativity Problem Solving User Experience,Gaming,High paying
